id,name,host_location,latitude,longitude,bedrooms
12372052,3 min to subway T stop-Orange Line,"Medford, Massachusetts, United States",42.38323056,-71.07732678,2
13830152,Room in a house 3 min to T stop-10 min to downtown,"Medford, Massachusetts, United States",42.38390708,-71.07878596,1
5719606,Stunning 2-Bed/2-Bath Townhouse in Historic Area,"Boston, Massachusetts, United States",42.3745555,-71.05977738,2
182613,Clean 3 Beds apt Charlestown Boston,United States,42.37738703,-71.0604352,2
5620496,Beautiful City Rental,"Boston, Massachusetts, United States",42.37816268,-71.06755657,2
82637,Nautical Room: Bunker Hill B&B,"Boston, Massachusetts, United States",42.3783338,-71.06181846,1
3820516,Silk Road Room ,"Boston, Massachusetts, United States",42.37643549,-71.06535119,1
14501620,Charlestown Harbor Apartment,"Boston, Massachusetts, United States",42.37681268,-71.05375565,2
13371105,"14 min to Harvard, MIT, Downtown Crossing and MGH","Malden, Massachusetts, United States",42.38214292,-71.08064408,1
14632658,Townhouse in the Town Bedroom #1,"Boston, Massachusetts, United States",42.38344851,-71.06511108,1
7321217,Charlestown Penthouse w/ roof deck,"Boston, Massachusetts, United States",42.38154089,-71.07023648,1
1102623,Penthouse Bedroom on Freedom Trail,"Boston, Massachusetts, United States",42.37475773,-71.05941798,1
7472068,Beautiful Bunker Hill 2 BD,"Boston, Massachusetts, United States",42.37824827,-71.06198814,2
7053454,Basement apartment in Charlestown,"Boston, Massachusetts, United States",42.38005488,-71.06324105,1
1755376,[1535-1C] 1BR - West End High Rise,US,42.36380266,-71.06776691,1
4917583,Seconds from Mass General Hospital,"Boston, Massachusetts, United States",42.36401182,-71.06782412,1
12130434,[1247-2C]Furnished 2BR At The Vesta,US,42.36429053,-71.06837612,2
10118573,Furnished Luxury 1BR West End-Apt,US,42.36327128,-71.0694316,1
979759,"[1798]2BR at Emerson Place, Boston",US,42.36623458,-71.06784618,2
14423483,Beautiful 2-BR Condo 0.5 Mile to Boston Common LF2,"Spokane, Washington, United States",42.3642835,-71.06535459,2
14404992,"Beautiful view, perfect location!","Boston, Massachusetts, United States",42.3660401,-71.06971035,1
8696236,Private Room in Downtown Boston MGH,"Boston, Massachusetts, United States",42.36542677,-71.06773018,1
8814479,Beautiful 2BR Downtown Boston! LF2,"Spokane, Washington, United States",42.3627073,-71.06547333,2
8191739,BOSTON JUST IN FRONT MGH HOSPITAL,US,42.36319668,-71.06810432,1
965554,[1535-2C]2BR - West End High Rise,US,42.36435858,-71.06953391,2
8814039,In The Heart of Boston!! LF3,"Spokane, Washington, United States",42.36379199,-71.06400909,3
8813451,Beautiful 3BR Boston Location! LF3,"Spokane, Washington, United States",42.36385227,-71.06469886,3
14908177,Very PRIVATE condo - Close to T - No cleaning fee!,"Boston, Massachusetts, United States",42.36224577,-71.06783678,1
1358531,[1247-2NH]Furnished 2BR At The Vesta,US,42.36334249,-71.06997794,2
4602191,Stunning Apartment on Charles River,"Boston, Massachusetts, United States",42.36415711,-71.06811909,2
7596262,Furnished Luxury 1BR West End Apt.,US,42.36502919,-71.06913787,1
8191517,BOSTON - MGH -Beacon Hill- Downtown- great locatio,US,42.36225166,-71.06804508,1
12088322,Furnished Luxury 2BR at West End,US,42.36550572,-71.06818136,2
13545648,"Longfellow Place, Lux 2bd West End/Beacon Hill","New York, New York, United States",42.36419492,-71.06430057,2
10119075,Furnished Luxury 2BR at West End,US,42.36481896,-71.06907672,2
4467841,Lux 2BR Apt Near Waterfront,"New York, New York, United States",42.3639001,-71.06997018,2
3931204,Beacon Hill Lux 1BR w/pool & WiFi,"New York, New York, United States",42.36404531,-71.06478588,1
10118716,Furnished Luxury 2BR at West-End,US,42.36547468,-71.06891649,2
9644312,Great Apt in historic Beacon Hill,"Paris, Île-de-France, France",42.36129982,-71.0716176,1
10118946,Furnished Lux 2BR at West End,US,42.3648619,-71.06715419,2
10118379,Furnished Luxury 1BR West End Apt.,US,42.36318985,-71.06910538,1
7857318,Luxury West End 2BR Apartment,US,42.36360383,-71.07035471,2
10118091,Furnished Luxury 1BR West End Apt,US,42.36523378,-71.06779638,1
10052037,Luxury West End 1BR Apt.,US,42.36480167,-71.06865495,1
10152056,Furnished Luxury West End 1BR Apt.,US,42.36480762,-71.06893039,1
10119193,Furnished Luxury 2-BR at West End,US,42.36466804,-71.06942445,2
10051649,Luxury West End 2BR Apt,US,42.36479585,-71.07010306,2
25418,[1535-1N] 1BR - West End High Rise,US,42.36494498,-71.0676682,1
10051842,Luxury West End 2BR Apt.,US,42.36513193,-71.06975166,2
7855702,Furnished Luxury 2BR at West End,US,42.36514744,-71.06754833,2
11967208,1BR West End Apt. near Restaurants,"Boston, Massachusetts, United States",42.36169551,-71.06575767,3
4610745,Stay in the Heart of Boston,"Boston, Massachusetts, United States",42.361232,-71.07050792,0
23668,[1247-1N]Furnished 1BR At The Vesta,US,42.36386502,-71.06895044,1
10119327,Furnished Luxury 2BR at West End,US,42.36329131,-71.06710682,2
10327517,Luxury 1BR|1BA+porch MGH/BeaconHill,US,42.36512257,-71.06859844,1
6015995,1BR West End Apt. near Restaurants,US,42.3637254,-71.06815872,1
7308623,Beautiful Apartment in Beacon Hill,"Boston, Massachusetts, United States",42.36184586,-71.06834786,1
4489920,"Lux 1BR near Charles St w/pool, gym","New York, New York, United States",42.36340801,-71.0676339,1
2769450,Charlesview Suites Beacon Hill ,"Cambridge, Massachusetts, United States",42.3634202,-71.07108146,1
14467554,West End ❤️ of Boston,US,42.36354351,-71.06945967,2
1867881,"Lux 2BR near Charles St w/pool, gym","New York, New York, United States",42.36511606,-71.06926305,2
1131634,West End 12th Floor: by Spare Suite,"Boston, Massachusetts, United States",42.36459425,-71.0654831,1
67774,Corner 1 bed facing Golden Dome,"Boston, Massachusetts, United States",42.35866925,-71.06331527,1
8309711,"Comfortable, sunny full 2BR condo","Boston, Massachusetts, United States",42.36115666,-71.06603416,2
5659866,Spacious Beacon Hill Apt!,"Boston, Massachusetts, United States",42.35781633,-71.06665887,2
1303261,HISTORIC BEACON HILL-ENJOY OUR CAT,"Boston, Massachusetts, United States",42.35880311,-71.06972216,1
6432655,Beautiful Beacon Hill 1 Bedroom,"Boston, Massachusetts, United States",42.36059644,-71.06666051,1
13249829,2990$ / mo. sunny & renovated 2 BDR in Beacon Hill,"Cambridge, Massachusetts, United States",42.36038188,-71.06780658,2
4900659,Comfortable 1 BR in Beacon Hill,"Boston, Massachusetts, United States",42.36062693,-71.06580134,1
7928656,Studio at Beacon Hill / MGH,"Cambridge, Massachusetts, United States",42.3593429,-71.06879856,1
9386847,Beacon Hill Classic Downtown Boston,"Bogota, Bogota, Colombia",42.359355,-71.06436762,2
6444148,Chic Beacon Hill One Bed Apt,"Boston, Massachusetts, United States",42.35997591,-71.06678112,1
10311094,Great 3BR 3BA Back Bay Penthouse,"Boston, Massachusetts, United States",42.35687786,-71.07395821,3
9596153,Beacon Hill Charmer,"New York, New York, United States",42.35805049,-71.07132939,1
14025410,"Beacon Hill private studio, near Charles St.",US,42.35998238,-71.06812794,0
3377871,COZY 4th fl. historic Beacon Hill,"Boston, Massachusetts, United States",42.36082995,-71.06417988,1
59776,Beacon Hill Bed and Breakfast,US,42.35770804,-71.0724202,1
6488924,Beacon Hill Brown Stone,"Boston, Massachusetts, United States",42.36029553,-71.06958376,1
9232355,Perfect Location Beacon Hill Studio,"Boston, Massachusetts, United States",42.3583922,-71.06437784,0
11202183,Second Oldest Home in Beacon Hill,"Boston, Massachusetts, United States",42.35772102,-71.06628546,0
4718577,Private Room in Beacon Hill,"Boston, Massachusetts, United States",42.35766203,-71.0706934,1
12648403,Location: Amazing,"Boston, Massachusetts, United States",42.3589034,-71.07009065,0
13778731,Beautiful Beacon Hill 1 Bedroom,"Boston, Massachusetts, United States",42.35913966,-71.07109732,1
2126053,"Studio, with kitchen, in owner's Beacon Hill home","Boston, Massachusetts, United States",42.3567161,-71.0714717,0
5690640,Historic Beacon Hill 1+ BR Apt,"Boston, Massachusetts, United States",42.35841508,-71.06891422,1
2823378,Come & Explore Beacon Hill!! ,"Boston, Massachusetts, United States",42.36080165,-71.06450368,1
13810937,1 Bedroom in Beacon Hill,"Cambridge, Massachusetts, United States",42.36046972,-71.06954017,1
7633883,New 3 Bed/2 Ba Duplex - Beacon Hill,"Boston, Massachusetts, United States",42.35737821,-71.07135091,3
8732121,"Temple Street By Maverick, Ten","Middlesex County, Massachusetts, United States",42.36070877,-71.0642183,0
2423613,Quiet top floor of brownstone!,"Boston, Massachusetts, United States",42.36090969,-71.06510424,1
13728510,Complete Renovation! BEACON HILL!!,"Boston, Massachusetts, United States",42.35915095,-71.06681644,0
12493396,One-BR Apt in Heart of Beacon Hill,"Massachusetts, United States",42.35848075,-71.06947903,1
8052494,One-bedroom Apartment Beacon Hill,"Boston, Massachusetts, United States",42.35833271,-71.06717657,1
7092874,Well lit condo in BeaconHill Boston,"Boston, Massachusetts, United States",42.35569736,-71.07316574,2
13433475,Beacon Hill 2bed2bath BEST LOCATION,"Boston, Massachusetts, United States",42.35849849,-71.06925489,2
2947662,2BR PENTHOUSE W/Deck Boston Center,"Boston, Massachusetts, United States",42.3600071,-71.06661126,2
7911936,"Temple Street By Maverick, One","Middlesex County, Massachusetts, United States",42.3608364,-71.06412894,0
2754975,Perfect Location to Explore Boston,"Boston, Massachusetts, United States",42.35756838,-71.06366055,1
13521992,Comfy room in the heart of Boston,"Boston, Massachusetts, United States",42.35836714,-71.06982921,1
13138055,Beautiful apt. in the heart of Beacon Hill,"Boston, Massachusetts, United States",42.35847193,-71.06826281,1
7713815,"Temple Street By Maverick, Two","Middlesex County, Massachusetts, United States",42.35958022,-71.06396674,0
8747720,"1 Bedroom Apt Beacon Hill, Boston","New York, New York, United States",42.35840072,-71.07021794,1
4995033,Modern Beacon Hill 2 Bedroom ,US,42.35974858,-71.06617818,2
9107357,An Elegant Condo in Beacon Hill,"Boston, Massachusetts, United States",42.35802834,-71.07198029,1
5064995,Beacon Hill Brownstone,"Keene, New Hampshire, United States",42.36078945,-71.06710894,2
6600417,Boston's finest! Huge Roof Deck!,"Easton, Massachusetts, United States",42.35685565,-71.07025136,1
10434883,Cedars on Beacon Hill Studio Suite,"Boston, Massachusetts, United States",42.3572179,-71.07050228,0
13121821,Beacon Hill condo w/ outdoor space,"Boston, Massachusetts, United States",42.35997895,-71.064786,1
9844242,Convenient Beacon Hill hideaway,"Boston, Massachusetts, United States",42.36085747,-71.0659436,1
13295184,"BEACON HILL, Steps to MGH, Charles","Boston, Massachusetts, United States",42.3605456,-71.06911628,2
6763785,Little Room on the Hill,"Boston, Massachusetts, United States",42.36105124,-71.0667853,1
586994,位于比肯山的1卧單位房源,"Boston, Massachusetts, United States",42.35892584,-71.06310909,1
915272,Beacon Hill Sunny Studio,"Boston, Massachusetts, United States",42.35843137,-71.06814575,1
3520353,Luxury Beacon Hill Apartment 1-BR,"Boston, Massachusetts, United States",42.35779932,-71.06303531,1
4978467,Charming Beacon Hill 1+ BR Condo,"Boston, Massachusetts, United States",42.3605729,-71.06548639,2
14742722,Private Guest Room & Private Bath Room,"Boston, Massachusetts, United States",42.35736755,-71.06513533,1
7614517,Beacon Hill Studio w/ patio&parking,"Boston, Massachusetts, United States",42.3603321,-71.06792075,0
12356,"Renovated, State House View","Boston, Massachusetts, United States",42.35898849,-71.06324696,1
12726343,Beacon Hill,"Boston, Massachusetts, United States",42.35901992,-71.06569715,0
4632511,Historic Beacon Hill Duplex Condo 2 bedroom Queen,"Boston, Massachusetts, United States",42.36114287,-71.06521324,2
8384444,Charming Escape in Beacon Hill,"Boston, Massachusetts, United States",42.35789243,-71.06962757,1
6778788,Renovated Beacon Hill Beauty,"Boston, Massachusetts, United States",42.35870558,-71.06734735,1
2682662,Beacon Hill -Charles Street Studio ,"Boston, Massachusetts, United States",42.3588715,-71.06992198,0
14035936,Beacon Hill 2 bed 2 bath Penthouse,"Boston, Massachusetts, United States",42.35841014,-71.06822839,2
10611598,"Unique 1 B/B in Beacon Hill, Boston","Boston, Massachusetts, United States",42.36003478,-71.07059548,1
8090623,"Beacon Hill, Guestroom with private bath","Boston, Massachusetts, United States",42.35757078,-71.07230206,1
13300621,"3-Beacon Hill, MGH,  CableTV, Wifi","Boston, Massachusetts, United States",42.3585165,-71.0707104,2
14873017,"Bon Beacon Hill! 2 beds, close to everything!",US,42.35591934,-71.07196286,1
8614167,Boston apartment with 2 double beds,"Boston, Massachusetts, United States",42.35942834,-71.06985689,2
14758045,130 Myrtle st Apartments by The Lyon Org,"Boston, Massachusetts, United States",42.35800212,-71.0689558,1
11120777,"Beacon Hill, Charles St, MGH, Red T","Boston, Massachusetts, United States",42.35965441,-71.07040995,2
9235198,Charming Beacon Hill Room + Patio,"Boston, Massachusetts, United States",42.36059822,-71.06801531,1
6908672,Charming 2-Bedroom in Beacon Hill,"Boston, Massachusetts, United States",42.35811921,-71.07072938,2
13101775,Brimming With Life in Beacon Hill,"Cambridge, Massachusetts, United States",42.35830031,-71.07186924,1
5959251,Historic Beacon Hill/BackBay WOW!!!,"Boston, Massachusetts, United States",42.35679758,-71.07309059,1
14872018,"Hotel-Double bed, free breakfast, great location",US,42.35927534,-71.07166437,1
10857914,Beacon Hill Townhouse,"Boston, Massachusetts, United States",42.36076899,-71.06444906,4
12365159,Gorgeous apartement in Beacon Hill,"Boston, Massachusetts, United States",42.35878512,-71.06752595,1
13331733,"2-Beacon Hill w/PRIVATE DECK, MGH","Boston, Massachusetts, United States",42.35869538,-71.07146293,1
8662258,MGH hideaway in Beacon Hill,"Boston, Massachusetts, United States",42.35850496,-71.06405169,1
7531700,"Temple Street By Maverick, Three","Middlesex County, Massachusetts, United States",42.36093112,-71.06397603,0
13797236,Cosy apartment in heart of Beacon hill,"Boston, Massachusetts, United States",42.36031305,-71.06659067,1
2862120,Beacon Hill Downtown Sofabed in LR,"Honolulu, Hawaii, United States",42.36020415,-71.06839984,1
6089196,NEW- Boheme 1bdroom in Beacon Hill!,"Boston, Massachusetts, United States",42.35898071,-71.06664825,1
13658522,Great room in the heart of Beacon Hill,"Boston, Massachusetts, United States",42.35871892,-71.06958859,1
4532603,Heart of Boston - Beacon Hill,"Lexington, Massachusetts, United States",42.35957556,-71.06706379,1
9169272,Spacious one bedroom in Beacon Hill,"Boston, Massachusetts, United States",42.35964127,-71.06552063,1
6400348,Beacon Hill Luxury - Roof Deck!,"Easton, Massachusetts, United States",42.35674748,-71.07014338,1
1648950,Beautiful 1 Bedroom in Beacon Hill,"Boston, Massachusetts, United States",42.35927928,-71.06923437,1
13788865,Comfortable Studio on the Boston Commons,"Boston, Massachusetts, United States",42.35240941,-71.06484533,0
9857049,Cedars on Beacon Hill One Bedroom,"Boston, Massachusetts, United States",42.35744256,-71.06903191,1
14673441,Beacon Hill Home / Private Guest Room & Bathroom,"Boston, Massachusetts, United States",42.35910842,-71.06622664,1
11906382,Gorgeous new remodel in Beacon Hill 2BR/2BA,"Boston, Massachusetts, United States",42.36103656,-71.06384931,2
5743939,2BR BeaconHill Boston Center by Suffolk/MGH/MIT,"Boston, Massachusetts, United States",42.3601462,-71.06866123,2
3432321,"Large, Sunny Beacon Hill Studio",US,42.35505875,-71.07073415,0
4546333,"Charles St, Studio Apt, Boston #52","Boston, Massachusetts, United States",42.35787741,-71.06975349,0
9464030,Huge 1 Bed Apartment in Beacon Hill,"Boston, Massachusetts, United States",42.35819601,-71.07097882,1
7514024,"Temple Street By Maverick, Fourteen","Middlesex County, Massachusetts, United States",42.35935953,-71.06439165,0
13330146,Beacon Hill  1BR Amazing Views,"Boston, Massachusetts, United States",42.35877797,-71.07011902,1
10379031,"Huge, Stately, Clean, Beacon Hill, Reno, 1bd/1bh","Boston, Massachusetts, United States",42.36093936,-71.0637953,1
5725804,"Top floor Brownstone, tree-lined st","Boston, Massachusetts, United States",42.35924866,-71.06555837,1
4644455,Charming Modern 1 Bed,"Boston, Massachusetts, United States",42.35989236,-71.06707166,1
9133627,"Temple Street By Maverick, Four","Middlesex County, Massachusetts, United States",42.35989026,-71.0643643,0
13524454,Private Room in Beacon Hill,"Boston, Massachusetts, United States",42.36060324,-71.06692982,1
7527864,Great Private Room in Beacon Hill,"Boston, Massachusetts, United States",42.36018663,-71.0674905,1
3351728,Beautiful Boston Townhouse Living,"Boston, Massachusetts, United States",42.35713133,-71.07131447,5
6677640,Private Deck Beacon Hill,"Boston, Massachusetts, United States",42.36051978,-71.06401439,1
6480967,40 boylston,US,42.35242703,-71.06453349,1
1827762,1 Bedroom Apt: Downtown/Beacon Hill,"Hillsborough Township, New Jersey, United States",42.35883567,-71.06800152,1
7854872,"Temple Street By Maverick, Twelve","Middlesex County, Massachusetts, United States",42.35934474,-71.06291668,0
10855052,Sunny Beacon Hill Apartment!,"Boston, Massachusetts, United States",42.35761812,-71.06772096,1
13591091,"Charming, upscale Beacon Hill home","Boston, Massachusetts, United States",42.35993244,-71.06961503,1
4635390,Sunny Beacon Hill Apt by MGH,"Boston, Massachusetts, United States",42.35984259,-71.0690367,1
1745339,"Beacon Hill, Steps to Boston Common","New York, New York, United States",42.36033453,-71.06692518,0
7514336,"Temple Street By Maverick, Eleven","Middlesex County, Massachusetts, United States",42.36087383,-71.06299378,0
7874552,Beacon Hill's Charles St.,"Boston, Massachusetts, United States",42.35822852,-71.0698573,1
3673104,Bright Apartment Near Everything,"Boston, Massachusetts, United States",42.36062563,-71.06945747,1
8450098,"Beacon Hill, the Best of Boston!","Boston, Massachusetts, United States",42.35779195,-71.07137386,1
6742905,start here&walk all around boston,"Boston, Massachusetts, United States",42.36108738,-71.06531976,0
697078,Spacious 1 bed facing State House,"Boston, Massachusetts, United States",42.35893131,-71.063311,1
9755993,Beacon Hill Studio,"Boston, Massachusetts, United States",42.35936905,-71.0711618,0
3890373,BEACON HILL FABULOUS ONE BEDROOM,"Boston, Massachusetts, United States",42.35858437,-71.06549388,1
3873776,"Large, Sunny Beacon Hill Apartment","Boston, Massachusetts, United States",42.35725587,-71.07110977,3
14798673,1 bed Beacon Hill Close,"Boston, Massachusetts, United States",42.35836337,-71.06840785,1
13294558,"4-BEACON HILL, MGH, Fin Dist, BEST!","Boston, Massachusetts, United States",42.36053866,-71.07062362,2
13376457,Beacon Hill Studio across from Public Gardens,"Boston, Massachusetts, United States",42.35648905,-71.07076788,0
12210223,Sunny Beacon Hill Apt w Rooftop,"Boston, Massachusetts, United States",42.36042712,-71.0651511,1
12738816,Charming beacon hill apartment,"Boston, Massachusetts, United States",42.36031592,-71.06937549,1
6776075,Boston's Best Location and View,"Boston, Massachusetts, United States",42.35281062,-71.06528175,1
5709298,Central Boston Beacon Hill 2brm,"Boston, Massachusetts, United States",42.35986626,-71.06720103,2
6445917,Airy Studio Top of Beacon Hill,"Boston, Massachusetts, United States",42.35851402,-71.06647413,0
2776143,"On Beacon Hill: Shaker, Not Stirred","Boston, Massachusetts, United States",42.36087345,-71.06667207,0
23619,Newly upgrade Beacon Hill Studio,"Boston, Massachusetts, United States",42.35846014,-71.06326992,
7920759,"Beacon Hill- 2br, 2 bath Personal Home","Boston, Massachusetts, United States",42.3583459,-71.06692804,2
10164810,Prudential/South End 1BR Apt.,"Boston, Massachusetts, United States",42.35655823,-71.07279512,1
14572100,Cozy Cave Beacon Hill Studio,US,42.36006718,-71.06746135,0
11016623,1 Bed: Best Location In The City!,"Boston, Massachusetts, United States",42.35788881,-71.06311027,1
8428052,"Beacon Hill, 1 private bedroom","Boston, Massachusetts, United States",42.36066017,-71.0667256,1
14374965,Right in the heart of historic Beacon Hill,"Fort Benton, Montana, United States",42.35911504,-71.06592182,1
7527149,Gorgeous Boston Townhouse Apartment,"Boston, Massachusetts, United States",42.35703422,-71.07056203,4
7329849,Steal in Beacon Hill!,"Knoxville, Tennessee, United States",42.36032895,-71.06906867,1
3069104,Cozy 1BD in Historic Beacon Hill,"Boston, Massachusetts, United States",42.36075067,-71.06293513,1
1529393,BEACON HILL SPACIOUS 2BD/2BA UNIT,"Boston, Massachusetts, United States",42.36026127,-71.06685037,1
7918592,Classic Beacon Hill Apartment,"Boston, Massachusetts, United States",42.35916566,-71.06785397,1
9248612,Charming Beacon Hill Condo + Patio,"Boston, Massachusetts, United States",42.3606918,-71.06979685,2
54944,[1414] Renovated Beacon Hill Studio,US,42.35682271,-71.07024445,1
7837202,"Temple Street By Maverick, Fifteen","Middlesex County, Massachusetts, United States",42.36099232,-71.06444346,0
5445126,"Modern, sunny spot in heart of city",US,42.35691956,-71.07056504,1
2216767,Beautiful 1BD in Beacon Hill,"Boston, Massachusetts, United States",42.35915042,-71.06792989,1
14586440,Statehouse & Boston Common - 1 Bedroom Downtown,"Belmont, Massachusetts, United States",42.35841498,-71.06308213,1
250345,[1344] 1 BR Penthouse w/ Roof Deck,US,42.35648433,-71.06945208,1
5690424,Huge Beacon Hill House - Roof Deck!,"Easton, Massachusetts, United States",42.35818648,-71.07177429,4
14700046,Fantastic luxury beacon hill living,US,42.35988917,-71.06763874,1
4461613,"Temple Street By Maverick, Thirteen","Middlesex County, Massachusetts, United States",42.36080933,-71.06419291,1
6410674,Downtown Boston - Beacon Hill - New,"Honolulu, Hawaii, United States",42.36007901,-71.06696566,1
6066455,Large 3.5 BR|2 BA Penthouse Duplex,"Boston, Massachusetts, United States",42.36043324,-71.07134301,4
13307513,Elegant Beacon Hill apartment,"Washington, District of Columbia, United States",42.35987844,-71.07121097,1
8704161,"2nd floor, 2 story in Beacon Hill","Bolton, Massachusetts, United States",42.36047333,-71.06292946,2
10653150,"QUIET 2 Bedrooms-Beacon Hill Near T, No clean fee","Boston, Massachusetts, United States",42.35807845,-71.06472919,2
4787359,1BD in Beacon Hill w. Amazing roof,"Istanbul, Istanbul, Turkey",42.36054102,-71.06885722,1
3050565,Room in Beautiful Beacon Hill #14,"Boston, Massachusetts, United States",42.36056405,-71.06531415,1
13306811,Beacon Hill Urban Oasis,"Boston, Massachusetts, United States",42.36013879,-71.064072,0
7553969,Sunny studio in a great location.,"Boston, Massachusetts, United States",42.35946466,-71.0710648,0
11701611,"Classic, Quiet Beacon Hill Apt.","Redwood City, California, United States",42.35656319,-71.06996597,1
7244031,Beacon Hill 3rd Floor 1 BR,"Boston, Massachusetts, United States",42.36002601,-71.06484687,1
4032756,Airy Beacon Hill Flat w City Views,"Boston, Massachusetts, United States",42.36057009,-71.06815774,1
9078998,Studio on Charles St. in Beacon Hil,"Boston, Massachusetts, United States",42.35867253,-71.07007546,1
6326257,Renovated 2BR | 1.5BA on Charles St,"Boston, Massachusetts, United States",42.36110703,-71.07029268,2
3377100,Beacon Hill Townhouse near MGH,"Boston, Massachusetts, United States",42.3566927,-71.07297138,1
11306586,Awesome Location Beacon Hill Studio,"Boston, Massachusetts, United States",42.35876537,-71.06430905,0
7342359,"Bright, Open 1BR Apt in Beacon Hill","Boston, Massachusetts, United States",42.35990756,-71.0687935,1
7996844,Beacon Hill on Charles (#2),"Boston, Massachusetts, United States",42.35668074,-71.07155808,1
14124430,Brand New Beacon Hill Penthouse!,"Boston, Massachusetts, United States",42.3597596,-71.06759513,2
8471852,Awesome North End Studio,US,42.36077606,-71.06445564,1
12143408,Prime Beacon Hill 1BR Condo,"Boston, Massachusetts, United States",42.35767007,-71.06902611,1
8782592,Spacious 2 Bd Escape in Beacon Hill,"Boston, Massachusetts, United States",42.35897242,-71.06944362,2
10470115,Historic Beacon Hill 1BRw/Roof Deck,"Boston, Massachusetts, United States",42.35909773,-71.07124754,1
7635616,"Temple Street By Maverick, Nine","Middlesex County, Massachusetts, United States",42.3596006,-71.06390774,0
1886037,Beautiful Penthouse in Beacon Hill,"Boston, Massachusetts, United States",42.36056065,-71.07140572,2
11343485,Beacon Hill Gem! Spacious One Bedroom,"Boston, Massachusetts, United States",42.36077623,-71.06492874,1
8537786,Beacon Hill Room Available,"Boston, Massachusetts, United States",42.36035143,-71.06727344,1
9273978,Beacon Hill -Charles Street Studio,"Boston, Massachusetts, United States",42.35776698,-71.07210012,0
14407094,Modern comfort on Beacon Hill,"Boston, Massachusetts, United States",42.35998942,-71.06969178,1
14857569,"Hotel-Room w/twin bed, bathroom and free breakfast",US,42.35738898,-71.07036385,1
9273395,Spectacular Beacon Hill 1 bedroom,"Boston, Massachusetts, United States",42.35947329,-71.0721187,1
10945774,Historic Beacon Hill Studio Apt.,"Boston, Massachusetts, United States",42.35709462,-71.06919153,0
13993185,Adorable Beacon Hill One Bedroom,"Boston, Massachusetts, United States",42.3598051,-71.06881615,1
9274587,Spectacular Beacon Hill 1 bedroom,"Boston, Massachusetts, United States",42.35755878,-71.07171964,1
6554785,Apartment close to everything!,"Boston, Massachusetts, United States",42.35901849,-71.06304088,0
2998554,Penthouse w/ a deck in Beacon Hill,"Boston, Massachusetts, United States",42.3610648,-71.06636743,2
4359160,north slope studio in boston proper,"Boston, Massachusetts, United States",42.36107942,-71.06562534,0
3392423,Room in penthouse apt /Beacon Hill,"Boston, Massachusetts, United States",42.35933061,-71.0659257,1
14074739,The Red Brick Road,"Boston, Massachusetts, United States",42.36009793,-71.06780061,1
