id,name,host_location,latitude,longitude,bedrooms
9256035,Crisp Linen Living near Harvard Square,"Boston, Massachusetts, United States",42.36095775,-71.14129426,1
13642260,One bedroom apartment with a parking spot,"Brookline, Massachusetts, United States",42.34013099,-71.15834332,1
13577929,Beautiful room in Brighton,"Boston, Massachusetts, United States",42.34519238,-71.14053055,1
716245,Nice modern 2-bedroom in Boston ,"Boston, Massachusetts, United States",42.34502003,-71.16814211,2
4369675,Euston Rd Brighton MA!,US,42.34455,-71.14500419,1
10333345,Beautiful room in hipster town,"Boston, Massachusetts, United States",42.34598537,-71.13639659,1
1961034,1BR in Brighton,"Boston, Massachusetts, United States",42.34001059,-71.15542633,1
14707780,Chestnut Hill Studio Apartment,"Massachusetts, United States",42.34076213,-71.16203522,0
8404805,The Private Parking Space!,"Boston, Massachusetts, United States",42.36068612,-71.14150843,1
14250499,Cleveland Circle Room for the summer,US,42.34033213,-71.15130495,1
8417742,Cloud 9 near Harvard Square,"Boston, Massachusetts, United States",42.36102587,-71.14172423,1
12873438,Modern Townhouse next to T and BC,"Newton, Massachusetts, United States",42.3416215,-71.16701165,3
6449549,1 Sunny Bedroom,"Boston, Massachusetts, United States",42.34515786,-71.13659656,1
12052820,1B apt with sofa bed great location,"Santa Cruz de la Sierra, Santa Cruz, Bolivia",42.34682159,-71.13918597,1
76073,A beautiful house near the bus line,"Boston, Massachusetts, United States",42.35272493,-71.16881966,5
13624929,"Private Room in 1st floor apartment: Brighton, MA",United States,42.34424342,-71.15545336,1
583255,"Boston Beauty, Walk to C and B line","Brookline, Massachusetts, United States",42.34171325,-71.14851196,1
14460344,"Friendly Bunk Beds near Harvard, BU & BC","Boston, Massachusetts, United States",42.34595465,-71.15275051,1
6954861,Cozy and Easy Access to Everything,"Brookline, Massachusetts, United States",42.33881929,-71.14803889,1
8789821,Renovated -- Single Room,"Boston, Massachusetts, United States",42.36088535,-71.14162432,1
7511838,The Mandarin near Harvard Square,"Boston, Massachusetts, United States",42.35874345,-71.14000463,1
13264687,"Sofa-bed with laundry, Wi-Fi, and kitchen near BC","Massachusetts, United States",42.35639291,-71.16396428,1
11757251,Single Private Room in a House,"Newport Beach, California, United States",42.34538321,-71.13764337,1
8518237,Executive Garden Apartment,"Boston, Massachusetts, United States",42.34099873,-71.1599449,1
8461819,Cozy apartment in Boston,US,42.34982103,-71.16097749,1
466361,Funky Apartment in Boston-Brighton,"Boston, Massachusetts, United States",42.36107764,-71.14232534,2
2227959,"Small Cozy Rm, Great Loc, Comfy Apt","Boston, Massachusetts, United States",42.34488949,-71.13714359,1
9250014,The Tiffany Room near Harvard Square,"Boston, Massachusetts, United States",42.36072374,-71.1414734,1
4662379,Historic House modernized,"Temecula, California, United States",42.34771383,-71.1553971,4
2729015,"One bedroom, one bath apartment","Boston, Massachusetts, United States",42.35349154,-71.16255661,1
3318814,Private Room in a Boston Smart House w/ Backyard!,"Boston, Massachusetts, United States",42.36004671,-71.14668752,1
7840752,"Beautiful sunny room, walk to train!","Boston, Massachusetts, United States",42.34113082,-71.1597954,1
11494020,cozy sunny studio ( St Elizabeth H),"Boston, Massachusetts, United States",42.34701863,-71.14648281,0
8626752,Comfortable and Quiet,"Boston, Massachusetts, United States",42.35056521,-71.1624832,1
4628907,Private room in Brighton,"Boston, Massachusetts, United States",42.34942017,-71.140081,1
11067772,"sunny,cozy,near BC,BU,Boston,MBTA","Boston, Massachusetts, United States",42.34212025,-71.1543926,0
13674701,2BR 2BA w/AC & Parking,US,42.35082994,-71.16410558,2
13265095,Brighton 2BR by BC campus with lake view and AC,"Massachusetts, United States",42.33849421,-71.15534374,2
11921486,Charming bedroom in cozy apartment,US,42.34957661,-71.16087133,1
14754108,Penthouse room with a roof deck!,"Boston, Massachusetts, United States",42.35353576,-71.14414621,1
7509273,The Sail Loft near Harvard Square,"Boston, Massachusetts, United States",42.36088059,-71.14139967,1
1171578, Private Room in a One Family House,"Boston, Massachusetts, United States",42.35383952,-71.16794709,1
1937433,"Clean Getaway-near BU, BC, Harvard.","Boston, Massachusetts, United States",42.34799403,-71.14258802,1
7921649,The Rolls Royce Room near Harvard Square,"Boston, Massachusetts, United States",42.35964214,-71.1405689,1
13656969,Brighton - Cozy and Quiet Room in a Clean House,"Boston, Massachusetts, United States",42.35890612,-71.14400862,1
7054058,Spacious Apt w/Patio & BBQ,"Boston, Massachusetts, United States",42.33717042,-71.14965431,2
12739300,Cozy private room,,42.35053645,-71.16946077,1
7692933,Perfect for 1,"Boston, Massachusetts, United States",42.35567963,-71.16214487,1
9461126,"Sunny, Spacious 2 Bdrm, Close to T","Boston, Massachusetts, United States",42.3440144,-71.16894572,2
14780153,"Cosy, Clean, Great location","Boston, Massachusetts, United States",42.34591354,-71.15091592,1
10607657,The Heart of Cleveland Circle,"Boston, Massachusetts, United States",42.33851513,-71.15240773,1
11688611,Bright 2BR by BC Campus,"Montreal, Quebec, Canada",42.34152067,-71.14936702,2
7805515,The Presidential with Private Bath,"Boston, Massachusetts, United States",42.36090845,-71.14198714,1
14834257,Private bedroom in Brighton,"Boston, Massachusetts, United States",42.34581737,-71.14404933,1
11147761,"Lovely 2BR+,  2BA w/ Exercise Room","Massachusetts, United States",42.34106535,-71.15362521,2
4652263,Cozy 1 BR APT with assigned parking,"Boston, Massachusetts, United States",42.33925093,-71.15959684,1
13960193,Private room in Cambridge,US,42.34140546,-71.14994273,1
8378257,Gorgeous Brighton Home,"Boston, Massachusetts, United States",42.35126876,-71.14888345,1
14473036,Handsome 2BR in Allston,"Montreal, Quebec, Canada",42.33909037,-71.1534625,2
7476671,Eagle's Nest,"Boston, Massachusetts, United States",42.35057716,-71.1639392,1
2943893,"Spacious, cozy 1 BR apt in Boston","Boston, Massachusetts, United States",42.34217373,-71.15293747,1
7529525,Top Floor Condo off Comm Avenue,"Boston, Massachusetts, United States",42.34241664,-71.14260046,2
9255725,Power Flower Room near Harvard Square,"Boston, Massachusetts, United States",42.35907769,-71.14058989,1
9410831,10 Minutes southwest of Boston,US,42.35340079,-71.16644598,1
13490438,"Private cosy quiet room for one, central Allston","Boston, Massachusetts, United States",42.35661694,-71.13847571,1
9114896,"Pvt fl w/2BR, 1B, 1LR w/couchbed","Boston, Massachusetts, United States",42.35389221,-71.15954401,2
1185034,Private Condo in Boston,"Boston, Massachusetts, United States",42.33718956,-71.15143737,1
8934599,Renovated 3 Bed House Near Harvard!,"Boston, Massachusetts, United States",42.35929633,-71.14019686,3
1545185,New 1Bed w/ Gorgeous Kitchen + Bath,"Boston, Massachusetts, United States",42.34839859,-71.1569625,1
13333256,Nice bedroom in Boston. Right by the T.,"Philadelphia, Pennsylvania, United States",42.34031439,-71.14496231,1
12709469,near BC shuttle house summer sublet,,42.34054213,-71.14671038,1
13800294,Cozy Room for visiting Boston,"Medellin, Antioquia, Colombia",42.34641386,-71.13737308,1
13031523,Comfortable furnished room w/Queen bed +amenities.,"Albuquerque, New Mexico, United States",42.3611346,-71.14011364,1
8983081,"Modern 3 bed/1 bath, w/ Shower Spa","Boston, Massachusetts, United States",42.34612242,-71.1518799,3
3412990,c Secluded & Serene Allst/Brigh,"Brookline, Massachusetts, United States",42.35159257,-71.14421129,1
14864858,"Entire Two-Floor apartment,",US,42.35027128,-71.16941387,5
217498,"Private bedroom, bath and lounge.","Boston, Massachusetts, United States",42.35257298,-71.1505652,1
8753559,Quaint Room in a Classy Apartment,"Boston, Massachusetts, United States",42.35074237,-71.16995307,1
13111691,"Spacious 1BR apt, great for a couple, steps to T","Boston, Massachusetts, United States",42.34528024,-71.1477012,1
7721323,Nice studio near Boston College&BU,"Boston, Massachusetts, United States",42.33789228,-71.15631497,0
12833084,Your Home Away from Home,"Boston, Massachusetts, United States",42.34310294,-71.14985563,2
11035352,Comfortable quiet private room Allston for one,"Boston, Massachusetts, United States",42.35617773,-71.13870502,1
13684319,Quiet room Peaceful neighborhood Close to Harvard,"Boston, Massachusetts, United States",42.35971954,-71.14550049,1
7310887,Sunny Spacious Brookline Apartment,"Boston, Massachusetts, United States",42.34553887,-71.13819017,3
2526773,Charming comfort 1 BR / Studio,"Boston, Massachusetts, United States",42.34379756,-71.1563048,1
3181719,Double room full bath and Parking,"Boston, Massachusetts, United States",42.34857517,-71.15871821,1
14770708,"Neat, Clean, Great location","Boston, Massachusetts, United States",42.34760805,-71.15245248,1
8014950,"Sun-drenched & Airy Apt, near T",US,42.33689823,-71.15018023,1
6119918,"Cozy, Patio, Pool, and Whole Foods","New York, New York, United States",42.34505682,-71.13753461,1
6343532,Spacious Condo & Great for Groups,"Boston, Massachusetts, United States",42.34496089,-71.14961762,2
14322546,"Entire 3 bd apt close to MBTA, schools, stores","Boston, Massachusetts, United States",42.34555339,-71.13660702,0
13192046,"Brand new town house in Brighton, 2 parking spaces",US,42.35013328,-71.17146853,3
4410765,"Great Location & Value.Large 3 Bed, Min stay 3 mos","Boston, Massachusetts, United States",42.35365396,-71.14827415,3
5606682,Between BU/BC & great for groups,"Boston, Massachusetts, United States",42.34151874,-71.14917643,2
2014882,2 Bedrooms with 1 private bathroom,"New York, New York, United States",42.34126052,-71.15717343,1
11717217,"Best value-Cozy, quiet private room","Boston, Massachusetts, United States",42.34863623,-71.14064758,1
10226171,Cute Brookline Apartment!,"Boston, Massachusetts, United States",42.34135999,-71.14634379,1
7735518,2 Bedrooms Near Harvard Square!,"Boston, Massachusetts, United States",42.36044564,-71.14164164,1
14912536,In the City Without the Noise!,US,42.35060159,-71.15926434,3
9685102,Spacious double room in Boston MA,"Boston, Massachusetts, United States",42.33588717,-71.14895443,1
11569156,Clean spacious onebedroom apartment,"Massachusetts, United States",42.3399832,-71.15504853,1
4556374,Furnished bedroom in 2-bedroom apt ,"Boston, Massachusetts, United States",42.34438211,-71.16745949,1
7308811,Spacious 1BR on Green Line - BC BU,"New York, New York, United States",42.34472177,-71.14249483,1
14698794,Private room near Harvard Business School,"Boston, Massachusetts, United States",42.35451644,-71.13961328,1
4737304,Cosy Celtic Retreat,"Boston, Massachusetts, United States",42.34985003,-71.16451315,1
9896713,Camp Chandler Pond,"Boston, Massachusetts, United States",42.3474161,-71.16731949,1
10835494,High-end loft-style 2-bedroom condo,"Melrose, Massachusetts, United States",42.33999633,-71.15351639,2
6865619,fully-furnished 1 bed and 1 bath,"Newton, Massachusetts, United States",42.33829807,-71.1541233,1
3457722,Sunlit with easy access downtown!,"Boston, Massachusetts, United States",42.35457384,-71.15949264,3
1327725,Modern 2 BR in Brighton,"Boston, Massachusetts, United States",42.34566831,-71.13921858,2
3606396,Luxury 1BR Apartment By Subway,US,42.34127612,-71.14638193,1
13222465,"Brand new town house in Brighton, private bathroom",US,42.34993402,-71.17178882,1
4456987,Private room/bath in single family,"Boston, Massachusetts, United States",42.34851178,-71.16796813,1
4489752,Beautiful Boston 2 Bed Apartment,"Boston, Massachusetts, United States",42.3411289,-71.14256187,2
13156872,1 BR in Brighton,"Boston, Massachusetts, United States",42.33867207,-71.15702915,1
13374823,Bedroom in Spacious Brighton Apartment,"Boston, Massachusetts, United States",42.34014736,-71.14800087,1
1523772,Blue & White Haven,"Boston, Massachusetts, United States",42.35373011,-71.16107243,1
14500012,"Private bed room near BC,BU, Fenway","New York, New York, United States",42.33839098,-71.15149542,1
2294730,Nice room in house/Harvard square,California,42.36056204,-71.13901362,1
8962914,Lovely place with a balcony,"Boston, Massachusetts, United States",42.34365613,-71.14689232,1
5784404,Single Room Near Harvard,"Boston, Massachusetts, United States",42.35944906,-71.14049677,1
4670285,Spacious Room in Edwardian Home,"Boston, Massachusetts, United States",42.34916139,-71.16347987,1
13960293,Sweetest place ever ❤️,"Boston, Massachusetts, United States",42.35399435,-71.14661545,1
14402688,Cozy Brighton Apartment,"Boston, Massachusetts, United States",42.34549039,-71.1408144,1
295285,"Single Bedroom, Quiet Neighborhood","Boston, Massachusetts, United States",42.28719371,-71.16815974,1
11441717,"Clean, Quiet, and Comfortable","Boston, Massachusetts, United States",42.27260583,-71.14669033,1
962610,Convenient Boston Hotel Alternative,"Boston, Massachusetts, United States",42.29052559,-71.14105591,1
14767573,"Spacious room, shared bath",US,42.29601642,-71.15514783,1
5270703,Mrs. Herrera,US,42.26344341,-71.14864176,1
14303090,Cozy Remodeled Compact  Apartment,"Boston, Massachusetts, United States",42.27231978,-71.16249813,2
3521944,"Beautiful, Quiet, and Safe!",US,42.2971352,-71.15828888,1
1161210,Cozy rooms with parking and Wi-Fi,"Boston, Massachusetts, United States",42.27176131,-71.16759241,1
14878512,Adreani's Pied-a Terre.,"Boston, Massachusetts, United States",42.28540535,-71.15538042,1
12708781,"Charming, Cozy, Convenient Home",US,42.28909024,-71.16785456,3
11662212,Suburban room in the city,"Boston, Massachusetts, United States",42.29419543,-71.13817106,1
14692682,Spacious West Roxbury House,"Boston, Massachusetts, United States",42.2719084,-71.14780587,1
13938959,"Cute cozy room , sun-filled close to VA Medical",US,42.26960583,-71.16404357,1
8265182,"Charming Room, Free Parking & WiFi","Boston, Massachusetts, United States",42.2739113,-71.16761654,1
601763,The Alameda 2 | 2BR 1BA | 2nd Floor,"Boston, Massachusetts, United States",42.29118077,-71.15316227,2
13266176,Private Room with Queen Bed,"Boston, Massachusetts, United States",42.27427279,-71.16860806,1
10185866,Beautiful large 2 BR for three week,US,42.26338566,-71.15365616,2
4698367,Beautiful 2BD / 1 BA - 2nd Floor,"San Francisco, California, United States",42.27795632,-71.16180762,2
7513906,"Temple Street By Maverick, Six","Middlesex County, Massachusetts, United States",42.28009559,-71.16076254,0
13028899,"New King Bed, Free Parking&WiFi","Boston, Massachusetts, United States",42.27408555,-71.168792,1
13491626,Nice large bedroom with private bathroom,"Newton, Massachusetts, United States",42.30166976,-71.16482634,1
4530670,West Roxbury (Boston) private room,"Boston, Massachusetts, United States",42.27174515,-71.16148454,1
6300089,"Rustic, european style 3 bed/2bath","Boston, Massachusetts, United States",42.28641216,-71.15371574,3
9926796,A safe and private place to stay!,US,42.26569049,-71.15989519,1
9301075,Double in Arts & Crafts Bungalow,"Boston, Massachusetts, United States",42.27737752,-71.14357087,1
13261681,Private Room w/ Two Queen Comfortable Beds,"Boston, Massachusetts, United States",42.27426067,-71.16704389,1
13015767,Private Room with Queen and Twin Beds,"Boston, Massachusetts, United States",42.2724567,-71.16863145,1
7854569,Quiet and safe,US,42.29402267,-71.15135766,1
10279083,"Clean, Convenient and Comfortable","Boston, Massachusetts, United States",42.29198823,-71.14110861,1
9607296,Be our Guest in Boston,"Boston, Massachusetts, United States",42.27066203,-71.1687514,1
6706463,Cozy bedroom,US,42.29067315,-71.15114082,1
14685903,SPACIOUS private Boston home surrounded by nature!,"Boston, Massachusetts, United States",42.29955322,-71.12913835,2
14159799,Large Two bedroom apartment,AW,42.29084228,-71.15311176,1
8720673,A HOME AWAY FROM HOME,"Boston, Massachusetts, United States",42.27335047,-71.16418823,1
1757417,Queen in Arts & Crafts Bungalow,"Boston, Massachusetts, United States",42.27753725,-71.1434784,1
10964552,"Quiet, Clean, and Comfortable","Boston, Massachusetts, United States",42.27307169,-71.14653442,1
13487348,Private room in attic,"Boston, Massachusetts, United States",42.27609545,-71.16250419,1
14552489,Charming 1Bdrm Apt Close to Boston and Colleges,"Fort Lauderdale, Florida, United States",42.30190376,-71.16733329,1
6261296,"Free parking, spacious private room","Boston, Massachusetts, United States",42.29018544,-71.15637538,1
12618291,Historic Single Family Victorian!,"Boston, Massachusetts, United States",42.28075654,-71.15321436,5
14677678,Charming 3 BR Home in Quiet Boston Neighborhood,"Boston, Massachusetts, United States",42.29561419,-71.1460808,3
9340410,Two rooms in Arts & Crafts Bungalow,"Boston, Massachusetts, United States",42.27700842,-71.14533107,1
9292118,Beautiful 2BD / 1 BA - 1st Floor,"San Francisco, California, United States",42.27782355,-71.16211726,2
164418,"Room in quiet, residential area","Boston, Massachusetts, United States",42.2951183,-71.14877024,1
7275018,Bright and Airy Family Home,"Boston, Massachusetts, United States",42.29030248,-71.16061241,2
4180178,Sail Away Room ,"Boston, Massachusetts, United States",42.26519712,-71.10988075,1
11626869,Ck,US,42.26769074,-71.12566041,1
13827734,Cozy Private Room in Hyde Park,"Boston, Massachusetts, United States",42.26288685,-71.12072645,1
1391492,"Quiet bedroom, quilts and parking","Boston, Massachusetts, United States",42.24404517,-71.11786432,1
9550398,"Large nice room, with 2 twin beds","Boston, Massachusetts, United States",42.2637184,-71.12021697,1
10127270,Beautiful room in Boston,"Boston, Massachusetts, United States",42.24468153,-71.12189327,1
13907143,Bright and very spacious private room,"Boston, Massachusetts, United States",42.23615182,-71.12721618,1
6401859,`Hidden Gem in Boston,"Boston, Massachusetts, United States",42.24652032,-71.11623177,1
4698487,ONE NIGHT STAY BEAUTIFUL VICTORIAN,"Boston, Massachusetts, United States",42.26137965,-71.11797686,4
14593751,Home Away From Home,US,42.2556061,-71.12127529,1
6613472,Cozy Private Studio,"Boston, Massachusetts, United States",42.26895526,-71.1038348,1
3974503,The King's Palace ,"Boston, Massachusetts, United States",42.26653249,-71.10883175,1
7497047,Clean and quiet close to T,"Boston, Massachusetts, United States",42.23594181,-71.13246486,1
7185881,Room Close to public transportation,"Boston, Massachusetts, United States",42.23688869,-71.13291248,1
8645254,"Lovely, Quiet Room","Boston, Massachusetts, United States",42.25970386,-71.11936524,1
14719754,Cosy top floor room.,US,42.26953657,-71.11881602,1
13296735,Cozy 1 bedroom in stylish Cape,"Boston, Massachusetts, United States",42.24448149,-71.11683436,1
11983286,1 Bedroom in a 2 Bedroom Condo,"Boston, Massachusetts, United States",42.25893588,-71.11887043,1
9607385,1 Private Bedroom,"Boston, Massachusetts, United States",42.26773383,-71.13046552,1
6131224,Hidden Gem in Boston (Hyde Park),"Newton, Massachusetts, United States",42.26224663,-71.1138658,3
7840411,Cozy House in Quiet Neighborhood,"Boston, Massachusetts, United States",42.25933937,-71.11780849,3
5344465,Charming single family home,"Boston, Massachusetts, United States",42.26692819,-71.10242031,1
7900936,Morning Glory Bed & Breakfast!,"Boston, Massachusetts, United States",42.24200541,-71.12377771,1
13275334,Spacious Master Bedroom with Personal Bath,US,42.26998701,-71.11649406,1
7441144,Charming single family home,"Boston, Massachusetts, United States",42.2667996,-71.10297277,1
8490356,Gorgeous and bright Victorian home,"Boston, From Jamaica ",42.25161821,-71.11464543,1
2886933,BEAUTIFUL VICTORIAN SINGLE FAMILY!,"Boston, Massachusetts, United States",42.26118295,-71.11988803,4
3164650,Cozy Room. Safe and Convenient Area,"Boston, Massachusetts, United States",42.23596855,-71.13151374,1
4699828,Charming Victorian Furnished Home,"Boston, Massachusetts, United States",42.25486441,-71.12736661,2
13697676,Beautiful Room in a welcoming Boston Neighborhood,"Boston, Massachusetts, United States",42.23679257,-71.13132971,1
14778561,"Warm spacious, clean room.  You will Restmore","Boston, From Jamaica ",42.25261003,-71.11615659,1
14272646,The cardinal room,"Boston, Massachusetts, United States",42.28457495,-71.09531868,1
890705,Lower Mills Area Victorian Home,"Boston, Massachusetts, United States",42.27355644,-71.07085838,1
1173306,Lower Mills Victorian Home SuiteTwo,"Boston, Massachusetts, United States",42.27176297,-71.07144748,1
8133752,1850 Greek Revival House #1,"Boston, Massachusetts, United States",42.2728921,-71.07273106,1
4828640,Pvt Room in Lower Mills Dorchester,"Boston, Massachusetts, United States",42.27218849,-71.07055818,1
2931870,Victorian In-law,"Boston, Massachusetts, United States",42.27920777,-71.09527205,1
2931271,3 bedrooms in Victorian home.,"Boston, Massachusetts, United States",42.28099795,-71.09409502,1
2931165,Victorian Full Bed,"Boston, Massachusetts, United States",42.27950359,-71.09377488,1
10381729,Nice apartment with open floor plan,"Boston, Massachusetts, United States",42.28635522,-71.09483015,1
9826706,Baker Chocolate Factory,"Boston, Massachusetts, United States",42.27258125,-71.0685476,0
14086516,friendly family home,US,42.27513775,-71.07739962,1
4483906,Michelle's Comfort in ,"Boston, Massachusetts, United States",42.27724269,-71.08359319,1
8761060,"great apartment, cable tv/internet",US,42.27616093,-71.07530587,1
6006328,Cozy and Quaint home away from home,"New York, New York, United States",42.28189243,-71.09362734,2
8904546,City Suite,US,42.27042654,-71.07947367,1
12492474,Stay with Fun Family,"Boston, Massachusetts, United States",42.27398863,-71.0708349,1
8904297,Cozy Double Times II,US,42.27090115,-71.07875031,1
2529318,Family Home is close to everything,"Boston, Massachusetts, United States",42.27366902,-71.07709408,2
14686119,Stay with Fun Family,"Boston, Massachusetts, United States",42.27398658,-71.07228757,1
3839678,Bedroom close to Boston,"Milton, Massachusetts, United States",42.2700962,-71.08830739,1
14242888,Friendly family home bedroom # 2,US,42.27489916,-71.07706634,1
2278704,Victorian queen,"Boston, Massachusetts, United States",42.28192336,-71.09514436,1
14663819,Private Spacious Room,US,42.27136577,-71.07785733,1
14664852,Very Cozy Private room,US,42.27692027,-71.07724411,1
9047646,Convenient 1 Bedroom Apartment,US,42.31799742,-71.04020588,1
2515870,Excellent 1 Bedroom Apartment,"Boston, Massachusetts, United States",42.32221609,-71.0548548,1
12904318,Lovely cozy room close to Subway,"Boston, Massachusetts, United States",42.28358415,-71.06695111,1
7106162,Luxury Duplex Apartment,"Boston, Massachusetts, United States",42.31878288,-71.05250959,2
10234895,"Cozy room, 2 min walk to redline T","Boston, Massachusetts, United States",42.28318542,-71.0676302,1
177129,Comfort in Historic Melville Park 1,"Boston, Massachusetts, United States",42.29342799,-71.06773096,1
3522237,Harmonious and friendly place,"Boston, Massachusetts, United States",42.30629023,-71.0827115,1
14691657,Nice Cozy Room #2,US,42.31062061,-71.0549298,1
12971329,Cozy room in host's apt near train,"Boston, Massachusetts, United States",42.28366551,-71.06832234,1
1510876,Room with Single Bed,"Boston, Massachusetts, United States",42.31018704,-71.04828823,1
5729203,"Close to the zoo, shops and T","Boston, Massachusetts, United States",42.29265168,-71.07240752,1
13565183,Convenient Private Room with Airbed,"Boston, Massachusetts, United States",42.2826962,-71.07304305,1
570493,"2 Bedrms, 2 Priv Bath&Priv Entrance","Boston, Massachusetts, United States",42.28846783,-71.05477405,1
737519,Gorgeous 2 BR In Boston,"Boston, Massachusetts, United States",42.29398388,-71.05256831,2
14092792,"Cozy, room located near bus (to train station)","Boston, Massachusetts, United States",42.28458582,-71.08277889,1
6005290,Great Brownstone-Private Room,US,42.28713771,-71.06280658,1
7389719,A small cozy room outside of Boston,"Boston, Massachusetts, United States",42.28632627,-71.09002339,1
13928082,Gorgeous Boston 2 BR Apartment!,US,42.29532739,-71.05325872,2
1391215,Nice Cozy / room E,"Boston, Massachusetts, United States",42.2980111,-71.05844705,1
2794782,Room in renovated apartment (Queen size bed),"Boston, Massachusetts, United States",42.28284157,-71.07115571,1
6763587,Lorna's Oasis,"Boston, Massachusetts, United States",42.28355381,-71.08444105,1
2764624,Star light room,"Boston, Massachusetts, United States",42.30301007,-71.06354926,1
14928000,Mansion in Dorchester,US,42.30047564,-71.07697029,1
5891012,Living Room in Dorchester ,"Boston, Massachusetts, United States",42.31904632,-71.05797533,1
6160803,MODERN | 5BR 2BA | 5 min to BOS,"Southborough, Massachusetts, United States",42.2962129,-71.05454772,5
11410652,Sunny 2BR Savin Hill Apartment,"Boston, Massachusetts, United States",42.30961782,-71.05106927,2
77691,Beautiful Victorian House /room B,"Boston, Massachusetts, United States",42.29770901,-71.05979096,1
6014737,Splendid 1 Bdrm near publ trans.,"Boston, Massachusetts, United States",42.2910007,-71.07480272,1
179245,Room in Beautiful Townhouse /F,"Boston, Massachusetts, United States",42.29915433,-71.05878564,1
1732804,Private room in Boston,"Boston, Massachusetts, United States",42.29040678,-71.05853479,1
11376403,Nice Private Room with Airbed,"Boston, Massachusetts, United States",42.30420407,-71.07118365,1
3788075,Warm and Cozy II ,"Boston, Massachusetts, United States",42.30169262,-71.06263683,1
14682145,Cheapest place in city,"Boston, Massachusetts, United States",42.2798675,-71.04994322,1
14747561,Very Affordable PR with Airbed!,"Boston, Massachusetts, United States",42.3042288,-71.07255794,1
14826101,Comfortable and convenient room in Boston.,US,42.30300097,-71.06710708,1
8899828,Comfortable Brownstone Home,US,42.28771015,-71.06085871,1
